{
  "format_version": 1,
  "workload": "wasm-js-crossing-v1",
  "commit": "f1ff388563df",
  "platform": {
    "system": "darwin",
    "release": "25.5.0",
    "machine": "arm64"
  },
  "browser": "chromium",
  "parameters": {
    "deltas_per_run": 32,
    "runs_per_sample": 1,
    "samples": 1
  },
  "timing_ns": {
    "init_median": 30000000,
    "create_median": 4600000,
    "reducer_run_median": 17800000,
    "event_throughput_median": 3200000,
    "host_callback_median": 0,
    "wasm_drive_median": 17800000
  },
  "binding": {
    "overhead_percent": 0,
    "target_percent": 10,
    "within_target": true
  },
  "event_delivery": {
    "logical_events": 37,
    "model_deltas": 32,
    "js_host_callbacks": 1
  },
  "throughput": {
    "model_deltas_per_second": 9999.999850988392
  },
  "bundle": {
    "wasm_bytes": 5950310,
    "wasm_gzip_bytes": 1845934
  },
  "external_io": {
    "included_in_binding_comparison": false,
    "scope": "No network, provider, filesystem, or external store I/O"
  }
}
